<config mode="server" xmlns:xsi="http://www.w3.org/2001/XMLSchema" xsi:noNamespaceSchemaLocation="config.xsd">
	<bind ip="192.168.8.21" />
	<filter>
		<domain>Review</domain>
		<domain>Group</domain>
	</filter>
	<properties>
		<property name="failure-base-dir">/data/appdatas/cat/report/failure/</property>
		<property name="transaction-base-dir">/data/appdatas/cat/report/transaction/</property>
	</properties>
</config>