<config mode="client" enabled="true" xmlns:xsi="http://www.w3.org/2001/XMLSchema" xsi:noNamespaceSchemaLocation="config.xsd">
   <servers>
      <server ip="192.168.8.21" port="2280" enabled="true"/>
      <server ip="192.168.8.22" port="2281" enabled="false"/>
      <server ip="192.168.8.23" port="2280" enabled="true"/>
   </servers>
   <domain id="Group" enabled="true"/>
   <domain id="Review" ip="192.168.8.1" enabled="false"/>
   <bind ip="192.168.8.21" port="2280"/>
   <properties>
      <property name="failure-base-dir">/data/appdatas/cat/report/failure/</property>
      <property name="transaction-base-dir">/data/appdatas/cat/report/transaction/</property>
   </properties>
   <base-log-dir>target/catlog</base-log-dir>
</config>
